{
  "base_report": {
    "content_digest": "755cae3ab575355f102a0164a033d8ba784af7c59bbccefcd4dbdfe9e81d58ca",
    "report_id": "atlrep-c69f8f5f23d6d04a41dad7b138e429b9",
    "schema_version": "6.0.0"
  },
  "changed_dimensions": [
    {
      "after": {
        "overlay_detected": {
          "status": "observed",
          "value": true
        },
        "writable_sensitive_mounts": {
          "status": "observed",
          "value": [
            "/system"
          ]
        }
      },
      "before": {
        "overlay_detected": {
          "status": "observed_absent",
          "value": false
        },
        "writable_sensitive_mounts": {
          "status": "observed_absent",
          "value": []
        }
      },
      "dimension": "mount_integrity",
      "evidence_paths": [
        "mounts.integrity_summary"
      ],
      "interpretation": "Sensitive mount state changed. Review raw mount evidence before making any platform-integrity conclusion.",
      "severity": "high"
    },
    {
      "after": {
        "record_indices": [
          1,
          2,
          3,
          4,
          5
        ],
        "sources": [
          "/dev/block/dm-redacted"
        ],
        "state": "detected"
      },
      "before": {
        "record_indices": [
          0,
          1,
          2,
          3,
          4,
          5
        ],
        "sources": [
          "/dev/block/dm-redacted"
        ],
        "state": "detected"
      },
      "dimension": "dynamic_partition_state",
      "evidence_paths": [
        "mounts.dynamic_partitions"
      ],
      "interpretation": "Dynamic-partition evidence changed. This records layout evidence, not an integrity verdict.",
      "severity": "low"
    }
  ],
  "compare_report": {
    "content_digest": "609d2f9cd57057acb202c0f2f49bedf086bfe556b79a52de8e3b81fd17cb1601",
    "report_id": "atlrep-90d910be9cbab382d2f94a6bb4b5e6fb",
    "schema_version": "6.0.0"
  },
  "comparison": {
    "acknowledgement": "not_required",
    "axis": "same_target_state_change",
    "comparability": "comparable",
    "context": {
      "base": {
        "environment_context": "synthetic",
        "experiment_id": "E01_stock_avd",
        "measurement_id": "atlevent-730498d6c9dc0ca56f5b4c40e7d5b981",
        "observer": "adb_shell",
        "observer_effective_uid_is_root": "false",
        "observer_privilege": "shell",
        "protocol": "adb",
        "report_schema_version": "6.0.0",
        "state_id": "state-e01-stock-avd",
        "target_class": "avd",
        "target_pseudonym": "target-synthetic-avd"
      },
      "compare": {
        "environment_context": "synthetic",
        "experiment_id": "E03_writable_system_avd",
        "measurement_id": "atlevent-de5e7e106b075e9bba3467ca0b0e5537",
        "observer": "adb_shell",
        "observer_effective_uid_is_root": "false",
        "observer_privilege": "shell",
        "protocol": "adb",
        "report_schema_version": "6.0.0",
        "state_id": "state-e03-writable-system-avd",
        "target_class": "avd",
        "target_pseudonym": "target-synthetic-avd"
      }
    },
    "reasons": [
      "target_identity_matches",
      "target_class_matches",
      "state_identity_differs",
      "experiment_differs",
      "protocol_matches",
      "observer_matches",
      "observer_privilege_matches",
      "observer_effective_uid_matches",
      "report_schema_matches",
      "environment_context_matches",
      "measurement_differs"
    ],
    "visibility_context_changed": false,
    "warnings": []
  },
  "compatibility": {
    "canonical_comparison_schema_version": "6.0.0",
    "input_schema_versions": {
      "base": "6.0.0",
      "compare": "6.0.0"
    },
    "migration_mode": "temporary_in_memory",
    "migrations": {
      "base": [],
      "compare": []
    },
    "warnings": []
  },
  "confidence_changes": [],
  "content_digest": "566232bb492f9f5bc90a32527502917800bcfc7464469d2dbb9d42051e9f49a2",
  "diff_id": "atldiff-566232bb492f9f5bc90a325275029178",
  "missing_signals": [],
  "new_signals": [],
  "provenance": {
    "base": {
      "applied_migrations": [],
      "common_report": {
        "content_digest": "755cae3ab575355f102a0164a033d8ba784af7c59bbccefcd4dbdfe9e81d58ca",
        "report_id": "atlrep-c69f8f5f23d6d04a41dad7b138e429b9",
        "schema_version": "6.0.0"
      },
      "original_content_digest": "755cae3ab575355f102a0164a033d8ba784af7c59bbccefcd4dbdfe9e81d58ca",
      "original_document_digest": "2eaa44ba61f561016d9e264fa3bbe64b4d79a215331700290cd521de04075ad3",
      "original_report_id": "atlrep-c69f8f5f23d6d04a41dad7b138e429b9",
      "original_schema_version": "6.0.0"
    },
    "common_report_schema_version": "6.0.0",
    "compare": {
      "applied_migrations": [],
      "common_report": {
        "content_digest": "609d2f9cd57057acb202c0f2f49bedf086bfe556b79a52de8e3b81fd17cb1601",
        "report_id": "atlrep-90d910be9cbab382d2f94a6bb4b5e6fb",
        "schema_version": "6.0.0"
      },
      "original_content_digest": "609d2f9cd57057acb202c0f2f49bedf086bfe556b79a52de8e3b81fd17cb1601",
      "original_document_digest": "a506bd6b1fe4f62acad702ffc8d0630bb4f36d57ac7fa86fb75f460b76de7161",
      "original_report_id": "atlrep-90d910be9cbab382d2f94a6bb4b5e6fb",
      "original_schema_version": "6.0.0"
    }
  },
  "schema_version": "2.5.0",
  "summary": "2 dimensions changed, 25 dimensions unchanged.",
  "unchanged_dimensions": [
    "bootloader_lock_state",
    "verified_boot_state",
    "vbmeta_state",
    "verity_mode",
    "selinux_mode",
    "selinux_current_context",
    "selinux_denial_collection",
    "selected_process_visibility",
    "system_mount_resolution",
    "apex_mount_set",
    "root_shell_availability",
    "su_binary_visibility",
    "su_invocation_tested",
    "su_invocation_result",
    "root_management_artifact",
    "magisk_binary_visibility",
    "magisk_daemon_visibility",
    "magisk_process_visibility",
    "zygisk_visibility",
    "magisk_version_name",
    "magisk_version_code",
    "magisk_module_context",
    "magisk_command_status",
    "property_consistency",
    "emulator_state"
  ]
}
